<?xml version="1.0" encoding="UTF-8"?>

<!DOCTYPE robot-configuration SYSTEM "conf/dtd/robots.dtd">

<robot-configuration>

	<!-- The average amount of electrical power in kW needed each Martian Sol -->
	<power-consumption-rate value="3.0" />

	<!-- The average amount of fuel in kg (e.g. methane) needed each Martian Sol -->
	<fuel-consumption-rate value="1.0" />

	<!-- Number of sols a robot can go without power before low power mode sets in -->
	<!-- Default: 2.0 -->
	<low-power-mode-start-time value="2.0" />
	
	<!-- Minimum air pressure (Pa) a robt can withstand without harm -->
	<min-air-pressure value="500" />

	<!-- Minimum temperature (degrees celsius) a robot can withstand without harm -->
	<min-temperature value="-20.0" />

	<!-- Maximum temperature (degrees celsius) a robot can withstand without harm -->
	<max-temperature value="78.0" />

	<!-- Number of millisols a robot can survive below minimum temperature -->
	<!-- Note: 1 millisol = 88.77 seconds -->
	<freezing-time value="500.0" />

	<!-- List of robot type -->
	<robot-list>
		<robot name="ChefBot 001" type="ChefBot" settlement="Schiaparelli Point" job="Cook">
			<robotic-attribute-list>
				<robotic-attribute name="Strength" value="95"/>
				<robotic-attribute name="Endurance" value="95"/>
				<robotic-attribute name="Agility" value="40"/>
				<robotic-attribute name="Teaching" value="10"/>
				<robotic-attribute name="Experience Aptitude" value="95"/>
				<robotic-attribute name="Conversation" value="10"/>
			</robotic-attribute-list>
			<skill-list>
				<skill name="Botany" level="1"/>
				<skill name="Mechanics" level="1"/>
				<skill name="EVA Operations" level="2"/>
				<skill name="Trading" level="1"/>
				<skill name="Medicine" level="1"/>
				<skill name="Cooking" level="2"/>
				<skill name="Construction" level="1"/>
			</skill-list>
		</robot>
		
		<robot name="GardenBot 002" type="GardenBot" settlement="Schiaparelli Point" job="Gardener">
			<robotic-attribute-list>
				<robotic-attribute name="Strength" value="95"/>
				<robotic-attribute name="Endurance" value="95"/>
				<robotic-attribute name="Agility" value="40"/>
				<robotic-attribute name="Teaching" value="10"/>
				<robotic-attribute name="Experience Aptitude" value="95"/>
				<robotic-attribute name="Conversation" value="10"/>
			</robotic-attribute-list>
			<skill-list>
				<skill name="Botany" level="2"/>
				<skill name="Mechanics" level="1"/>
				<skill name="EVA Operations" level="2"/>
				<skill name="Trading" level="1"/>
				<skill name="Medicine" level="1"/>
				<skill name="Cooking" level="1"/>
				<skill name="Construction" level="1"/>
			</skill-list>
		</robot>
		
		<robot name="RepairBot 003" type="RepairBot" settlement="Schiaparelli Point" job="Handyman">
			<robotic-attribute-list>
				<robotic-attribute name="Strength" value="95"/>
				<robotic-attribute name="Endurance" value="95"/>
				<robotic-attribute name="Agility" value="40"/>
				<robotic-attribute name="Teaching" value="10"/>
				<robotic-attribute name="Experience Aptitude" value="95"/>
				<robotic-attribute name="Conversation" value="10"/>
			</robotic-attribute-list>
			<skill-list>
				<skill name="Botany" level="1"/>
				<skill name="Mechanics" level="2"/>
				<skill name="EVA Operations" level="2"/>
				<skill name="Trading" level="1"/>
				<skill name="Medicine" level="1"/>
				<skill name="Cooking" level="1"/>
				<skill name="Construction" level="1"/>
			</skill-list>
		</robot>
		
		<robot name="ConstructionBot 004" type="ConstructionBot" settlement="Schiaparelli Point" job="Builder">
			<robotic-attribute-list>
				<robotic-attribute name="Strength" value="95"/>
				<robotic-attribute name="Endurance" value="95"/>
				<robotic-attribute name="Agility" value="40"/>
				<robotic-attribute name="Teaching" value="10"/>
				<robotic-attribute name="Experience Aptitude" value="95"/>
				<robotic-attribute name="Conversation" value="10"/>
			</robotic-attribute-list>
			<skill-list>
				<skill name="Botany" level="1"/>
				<skill name="Construction" level="2"/>
				<skill name="EVA Operations" level="2"/>
				<skill name="Mechanics" level="1"/>
				<skill name="Medicine" level="1"/>
				<skill name="Cooking" level="1"/>				
				<skill name="Trading" level="1"/>
			</skill-list>
		</robot>

		<robot name="DeliveryBot 005" type="DeliveryBot" settlement="Schiaparelli Point" job="Postman">
			<robotic-attribute-list>
				<robotic-attribute name="Strength" value="95"/>
				<robotic-attribute name="Endurance" value="95"/>
				<robotic-attribute name="Agility" value="40"/>
				<robotic-attribute name="Teaching" value="10"/>
				<robotic-attribute name="Experience Aptitude" value="95"/>
				<robotic-attribute name="Conversation" value="10"/>
			</robotic-attribute-list>
			<skill-list>
				<skill name="Botany" level="1"/>
				<skill name="Trading" level="2"/>
				<skill name="EVA Operations" level="2"/>
				<skill name="Mechanics" level="1"/>
				<skill name="Medicine" level="1"/>
				<skill name="Construction" level="1"/>
				<skill name="Cooking" level="1"/>				
			</skill-list>
		</robot>	

		<robot name="MedicBot 006" type="MedicBot" settlement="Schiaparelli Point" job="Medic">
			<robotic-attribute-list>
				<robotic-attribute name="Strength" value="95"/>
				<robotic-attribute name="Endurance" value="95"/>
				<robotic-attribute name="Agility" value="40"/>
				<robotic-attribute name="Teaching" value="10"/>
				<robotic-attribute name="Experience Aptitude" value="95"/>
				<robotic-attribute name="Conversation" value="10"/>
			</robotic-attribute-list>
			<skill-list>
				<skill name="Botany" level="1"/>
				<skill name="Trading" level="1"/>
				<skill name="EVA Operations" level="2"/>
				<skill name="Mechanics" level="1"/>
				<skill name="Medicine" level="2"/>
				<skill name="Cooking" level="1"/>				
				<skill name="Construction" level="1"/>
			</skill-list>
		</robot>				
		
		<robot name="MakerBot 007" type="MakerBot" settlement="Schiaparelli Point" job="Maker">
			<robotic-attribute-list>
				<robotic-attribute name="Strength" value="95"/>
				<robotic-attribute name="Endurance" value="95"/>
				<robotic-attribute name="Agility" value="40"/>
				<robotic-attribute name="Teaching" value="10"/>
				<robotic-attribute name="Experience Aptitude" value="95"/>
				<robotic-attribute name="Conversation" value="10"/>
			</robotic-attribute-list>
			<skill-list>
				<skill name="Botany" level="1"/>
				<skill name="Materials Science" level="2"/>
				<skill name="EVA Operations" level="1"/>
				<skill name="Mechanics" level="1"/>
				<skill name="Medicine" level="1"/>
				<skill name="Cooking" level="2"/>				
				<skill name="Construction" level="1"/>
			</skill-list>
		</robot>				
	
	</robot-list>

</robot-configuration>
